{
  "confidence": "confirmed",
  "dependencies": [],
  "risk": "low",
  "status": "RESOLVED",
  "title": "OS completion could pass without real verification (unanchored mission/proofs, test-runner env masking)",
  "severity": "P1",
  "domain": "architecture",
  "evidence": [
    "architecture final review N2/N3/M-NEW-2",
    "adversarial final review finding 3",
    "new completion test: failing child suite reported PASS under NODE_TEST_CONTEXT"
  ],
  "rootCause": "Verify/proof commands matched by substring; mission.yml outside the fingerprint and git anchoring; executed commands inherited the parent test-runner context.",
  "producer": [
    ".claude/runtime/lib/evidence.mjs",
    ".claude/runtime/lib/completion.mjs",
    ".claude/runtime/mission.mjs"
  ],
  "consumers": [
    "completion verdict"
  ],
  "affectedFlow": "mission completion",
  "invariantViolated": "NO EVIDENCE = NO CLAIM",
  "blastRadius": "a mission verdict not backed by re-executed checks",
  "autofix": {
    "eligible": true,
    "reason": "runtime-only change with sandbox tests"
  },
  "correction": "lib/commands.mjs anchored allow-list; committed mission definition; derived mission findings; childEnv scrubbing; completion tests",
  "requiredTests": [
    "npm run test:claude-os"
  ],
  "regressionRisk": "medium — stricter policy may reject legitimate commands (covered by tests)",
  "impactLevel": "L4",
  "producerAgent": "architecture-reviewer",
  "id": "F-0017",
  "discoveredAt": "2026-09-25T18:51:05.144Z",
  "history": [
    {
      "status": "DISCOVERED",
      "at": "2026-09-25T18:51:05.144Z",
      "by": "architecture-reviewer",
      "note": "independent architecture review"
    },
    {
      "status": "TRIAGED",
      "at": "2026-09-25T18:51:21.169Z",
      "by": "autonomous-controller",
      "note": "confirmed from independent review report"
    },
    {
      "status": "READY",
      "at": "2026-09-25T18:51:21.259Z",
      "by": "autonomous-controller",
      "note": "autofix eligible"
    },
    {
      "status": "INVESTIGATING",
      "at": "2026-09-25T18:51:21.353Z",
      "by": "owner",
      "note": "traced in code"
    },
    {
      "status": "ROOT_CAUSE_CONFIRMED",
      "at": "2026-09-25T18:51:21.441Z",
      "by": "owner",
      "note": "root cause per finding"
    },
    {
      "status": "FIXING",
      "at": "2026-09-25T18:51:21.539Z",
      "by": "owner",
      "note": "fix in commits 9221b77 / 0eec60b"
    },
    {
      "status": "VALIDATING",
      "at": "2026-09-25T18:51:21.631Z",
      "by": "qa-lead",
      "note": "tests added and green locally"
    },
    {
      "status": "REAUDITING",
      "at": "2026-09-25T18:52:07.381Z",
      "by": "qa-lead",
      "note": "proof re-run on current code"
    },
    {
      "status": "RESOLVED",
      "at": "2026-09-25T18:52:07.533Z",
      "by": "product-flows-auditor",
      "note": "reaudit: detecting scenario/suite green on current code"
    },
    {
      "status": "INVESTIGATING",
      "at": "2026-09-25T19:02:26.501Z",
      "by": "architecture-reviewer",
      "note": "reopened: env prefix (NODE_TEST_CONTEXT/NODE_OPTIONS/PATH) and mission weakening by ordinary commit (EV-0036, EV-0037, EV-0038)"
    },
    {
      "status": "ROOT_CAUSE_CONFIRMED",
      "at": "2026-09-25T23:28:03.165Z",
      "by": "owner",
      "note": "env-prefix proof bypass; mission definition weakenable by ordinary commit; zero-test runs PASS"
    },
    {
      "status": "FIXING",
      "at": "2026-09-25T23:28:03.254Z",
      "by": "owner",
      "note": "fix in 1c7109f (ALLOWED_ENV, first-commit anchoring, ranNothing)"
    },
    {
      "status": "VALIDATING",
      "at": "2026-09-25T23:28:03.350Z",
      "by": "qa-engineer",
      "note": "required test green on HEAD (EV-0042)"
    },
    {
      "status": "REAUDITING",
      "at": "2026-09-25T23:28:03.437Z",
      "by": "regression-reviewer",
      "note": "reaudit: EV-0042 reproduces reviewer scenario on HEAD"
    },
    {
      "status": "RESOLVED",
      "at": "2026-09-25T23:28:03.562Z",
      "by": "autonomous-controller",
      "note": "proof EV-0042; server rebuilt from HEAD"
    },
    {
      "status": "INVESTIGATING",
      "at": "2026-09-25T23:39:13.233Z",
      "by": "architecture-reviewer",
      "note": "reopened: abort+restart empties scope (EV-0043); npmrc vacuous PASS and requiredTests binding bypass (EV-0044)"
    },
    {
      "status": "ROOT_CAUSE_CONFIRMED",
      "at": "2026-09-25T23:49:37.202Z",
      "by": "owner",
      "note": "scope derived from the current mission's anchor; records anchored only vs HEAD; proof env inherited npmrc; requiredTests substring match"
    },
    {
      "status": "FIXING",
      "at": "2026-09-25T23:49:37.290Z",
      "by": "owner",
      "note": "fix in b37e60f (scope base = last successful close; history-wide anchoring; childEnv npm isolation; argv requiredTests fail-closed)"
    },
    {
      "status": "VALIDATING",
      "at": "2026-09-25T23:49:37.382Z",
      "by": "qa-engineer",
      "note": "required test green on HEAD (EV-0046)"
    },
    {
      "status": "REAUDITING",
      "at": "2026-09-25T23:49:37.469Z",
      "by": "regression-reviewer",
      "note": "reaudit: EV-0046 covers the round-4 reproductions"
    },
    {
      "status": "RESOLVED",
      "at": "2026-09-25T23:49:37.587Z",
      "by": "autonomous-controller",
      "note": "proof EV-0046; server rebuilt from HEAD"
    },
    {
      "status": "INVESTIGATING",
      "at": "2026-09-26T00:02:13.101Z",
      "by": "adversarial-reviewer",
      "note": "reopened: project .npmrc node-options vacuous PASS; requiredTests widening (EV-0050 report)"
    },
    {
      "status": "ROOT_CAUSE_CONFIRMED",
      "at": "2026-09-26T00:12:15.303Z",
      "by": "owner",
      "note": "project .npmrc node-options; requiredTests widening; anchoring vs HEAD/merges"
    },
    {
      "status": "FIXING",
      "at": "2026-09-26T00:12:15.398Z",
      "by": "owner",
      "note": "fix in 2c2bdeb (npm isolation, all-suites verification, full-history anchoring)"
    },
    {
      "status": "VALIDATING",
      "at": "2026-09-26T00:12:15.492Z",
      "by": "qa-engineer",
      "note": "every requiredTests suite green on HEAD (EV-0057)"
    },
    {
      "status": "REAUDITING",
      "at": "2026-09-26T00:12:15.579Z",
      "by": "regression-reviewer",
      "note": "reaudit: EV-0057"
    },
    {
      "status": "RESOLVED",
      "at": "2026-09-26T00:12:15.710Z",
      "by": "autonomous-controller",
      "note": "proofs EV-0057; server rebuilt from 2c2bdeb"
    }
  ],
  "evidenceRecords": [
    "EV-0035",
    "EV-0042",
    "EV-0046",
    "EV-0057"
  ]
}
