{
  "confidence": "confirmed",
  "dependencies": [],
  "risk": "low",
  "status": "RESOLVED",
  "title": "Signed lead webhook followed redirects, dead-lettered 401/403 immediately, logged raw error text",
  "severity": "P2",
  "domain": "leads",
  "evidence": [
    "security-reviewer final report G-5/G-6/G-7 (.claude/reports/reviews/2026-09-25-security-reviewer-final.md)",
    "lib/contact.ts (9f9dad1): fetch without redirect option; dead-letter log with error.message",
    "lib/contact-outbox-policy.ts (9f9dad1): 401/403 permanent"
  ],
  "rootCause": "Delivery hardening covered timeouts and status classes but not redirect policy, credential-rejection semantics or log redaction.",
  "producer": [
    "lib/contact.ts#dispatchOutboxEvent",
    "lib/contact-outbox-policy.ts"
  ],
  "consumers": [
    "webhook receiver",
    "operators reading logs"
  ],
  "affectedFlow": "contact → outbox → receiver",
  "invariantViolated": "signed personal data only goes to the configured receiver; operational auth faults are recoverable; no secrets in logs",
  "blastRadius": "PII re-posted to redirect targets; all leads dead-lettered on one-sided secret rotation; URL tokens in logs",
  "autofix": {
    "eligible": true,
    "reason": "local policy/transport change with tests"
  },
  "correction": "redirect:'error'; 401/403 retryable within budget; status-class-only dead-letter log",
  "requiredTests": [
    "tests/unit/contact-outbox-policy.test.mjs",
    "tests/integration/contact-outbox-delivery.mjs"
  ],
  "regressionRisk": "low",
  "impactLevel": "L5",
  "producerAgent": "security-reviewer",
  "id": "F-0015",
  "discoveredAt": "2026-09-25T18:51:04.973Z",
  "history": [
    {
      "status": "DISCOVERED",
      "at": "2026-09-25T18:51:04.973Z",
      "by": "security-reviewer",
      "note": "independent security review"
    },
    {
      "status": "TRIAGED",
      "at": "2026-09-25T18:51:19.970Z",
      "by": "autonomous-controller",
      "note": "confirmed from independent review report"
    },
    {
      "status": "READY",
      "at": "2026-09-25T18:51:20.060Z",
      "by": "autonomous-controller",
      "note": "autofix eligible"
    },
    {
      "status": "INVESTIGATING",
      "at": "2026-09-25T18:51:20.160Z",
      "by": "owner",
      "note": "traced in code"
    },
    {
      "status": "ROOT_CAUSE_CONFIRMED",
      "at": "2026-09-25T18:51:20.261Z",
      "by": "owner",
      "note": "root cause per finding"
    },
    {
      "status": "FIXING",
      "at": "2026-09-25T18:51:20.360Z",
      "by": "owner",
      "note": "fix in commits 9221b77 / 0eec60b"
    },
    {
      "status": "VALIDATING",
      "at": "2026-09-25T18:51:20.456Z",
      "by": "qa-lead",
      "note": "tests added and green locally"
    },
    {
      "status": "REAUDITING",
      "at": "2026-09-25T18:52:06.860Z",
      "by": "qa-lead",
      "note": "proof re-run on current code"
    },
    {
      "status": "RESOLVED",
      "at": "2026-09-25T18:52:06.986Z",
      "by": "product-flows-auditor",
      "note": "reaudit: detecting scenario/suite green on current code"
    },
    {
      "status": "INVESTIGATING",
      "at": "2026-09-25T19:02:26.685Z",
      "by": "adversarial-reviewer",
      "note": "reopened: redirect test cannot fail (target refuses connections) (EV-0038)"
    },
    {
      "status": "ROOT_CAUSE_CONFIRMED",
      "at": "2026-09-25T23:28:02.588Z",
      "by": "owner",
      "note": "redirect test could not fail: target listener was never asserted"
    },
    {
      "status": "FIXING",
      "at": "2026-09-25T23:28:02.675Z",
      "by": "owner",
      "note": "fix in b5506e9 (redirect target asserted to receive 0 hits)"
    },
    {
      "status": "VALIDATING",
      "at": "2026-09-25T23:28:02.764Z",
      "by": "qa-engineer",
      "note": "required test green on HEAD (EV-0040)"
    },
    {
      "status": "REAUDITING",
      "at": "2026-09-25T23:28:02.863Z",
      "by": "regression-reviewer",
      "note": "reaudit: EV-0040 reproduces reviewer scenario on HEAD"
    },
    {
      "status": "RESOLVED",
      "at": "2026-09-25T23:28:03.045Z",
      "by": "autonomous-controller",
      "note": "proof EV-0040; server rebuilt from HEAD"
    },
    {
      "status": "INVESTIGATING",
      "at": "2026-09-26T00:10:57.731Z",
      "by": "autonomous-controller",
      "note": "re-verify: 2c2bdeb requires proofs that together run every requiredTests suite; earlier proofs ran only some"
    },
    {
      "status": "ROOT_CAUSE_CONFIRMED",
      "at": "2026-09-26T00:12:14.132Z",
      "by": "owner",
      "note": "earlier proofs ran only part of requiredTests"
    },
    {
      "status": "FIXING",
      "at": "2026-09-26T00:12:14.222Z",
      "by": "owner",
      "note": "product fix unchanged; re-verification under the all-suites rule (2c2bdeb)"
    },
    {
      "status": "VALIDATING",
      "at": "2026-09-26T00:12:14.323Z",
      "by": "qa-engineer",
      "note": "every requiredTests suite green on HEAD (EV-0051,EV-0052)"
    },
    {
      "status": "REAUDITING",
      "at": "2026-09-26T00:12:14.418Z",
      "by": "regression-reviewer",
      "note": "reaudit: EV-0051,EV-0052"
    },
    {
      "status": "RESOLVED",
      "at": "2026-09-26T00:12:14.561Z",
      "by": "autonomous-controller",
      "note": "proofs EV-0051,EV-0052; server rebuilt from 2c2bdeb"
    }
  ],
  "evidenceRecords": [
    "EV-0034",
    "EV-0040",
    "EV-0051",
    "EV-0052"
  ]
}
