{
  "confidence": "confirmed",
  "dependencies": [
    "DEC-0001"
  ],
  "risk": "medium",
  "discoveredAt": "2026-09-25T13:50:00.000Z",
  "id": "F-0006",
  "title": "Staff have no way to read contact submissions",
  "severity": "P1",
  "domain": "leads",
  "status": "NEEDS_PRODUCT_DECISION",
  "decision": "DEC-0001",
  "evidence": [
    "no app/admin page selects contact_submissions except the dashboard count (app/admin/(protected)/page.tsx:102)",
    ".env.example: LANDER_SAAS_WEBHOOK_URL 'leave unset until the real SaaS endpoint exists' → events disabled",
    "tests/unit/admin-navigation.test.mjs locks the sidebar item list"
  ],
  "rootCause": "The form's only human-facing destination was the future external receiver; no internal reading surface was built.",
  "producer": [
    "app/api/contact/route.ts"
  ],
  "consumers": [
    "none (staff)"
  ],
  "affectedFlow": "contact → staff follow-up",
  "invariantViolated": "A captured lead must reach a human",
  "blastRadius": "every lead requires direct DB access to be seen",
  "autofix": {
    "eligible": false,
    "reason": "placement (locked nav), role allowed to read PII and retention are product decisions"
  },
  "correction": "per DEC-0001 option A/B/C",
  "requiredTests": [
    "admin inbox authz negative tests (option A)"
  ],
  "regressionRisk": "n/a until decided",
  "impactLevel": "L3",
  "producerAgent": "leads-auditor",
  "history": [
    {
      "status": "DISCOVERED",
      "at": "2026-09-25T13:50:00.000Z",
      "by": "leads-auditor",
      "note": "form destination trace"
    },
    {
      "status": "TRIAGED",
      "at": "2026-09-25T13:51:00.000Z",
      "by": "autonomous-controller",
      "note": "P1 leads"
    },
    {
      "status": "NEEDS_PRODUCT_DECISION",
      "at": "2026-09-25T13:52:00.000Z",
      "by": "autonomous-controller",
      "note": "DEC-0001 opened: reading surface, role, retention"
    }
  ]
}
