{
  "confidence": "confirmed",
  "dependencies": [],
  "risk": "low",
  "discoveredAt": "2026-09-25T13:50:00.000Z",
  "id": "F-0010",
  "title": "Sitemap and contact form use URLs that 308-redirect (trailingSlash)",
  "severity": "P2",
  "domain": "seo",
  "status": "RESOLVED",
  "evidence": [
    "curl /sitemap.xml (base): <loc>https://landerrecords.com/contato</loc>; curl /contato → 308 /contato/",
    "Playwright (base): POST /api/contact → 308 → /api/contact/"
  ],
  "rootCause": "next.config trailingSlash: true while sitemap/form built slashless URLs.",
  "producer": [
    "app/sitemap.ts",
    "app/(public)/contato/ContactForm.tsx"
  ],
  "consumers": [
    "search engines",
    "contact submissions"
  ],
  "affectedFlow": "indexing; contact submit",
  "invariantViolated": "published URLs equal served URLs",
  "blastRadius": "every sitemap entry and every submission took an extra redirect",
  "autofix": {
    "eligible": true,
    "reason": "URL form only"
  },
  "correction": "absolutePageUrl for sitemap; form posts to /api/contact/",
  "requiredTests": [
    "tests/unit/seo-canonical.test.mjs",
    "tests/browser/contact-form.spec.ts (no 308 hop)"
  ],
  "regressionRisk": "low",
  "impactLevel": "L2",
  "producerAgent": "seo-auditor",
  "commits": [
    "23ded20",
    "10369be"
  ],
  "history": [
    {
      "status": "DISCOVERED",
      "at": "2026-09-25T13:50:00.000Z",
      "by": "leads-auditor",
      "note": "built-server curl + browser network log",
      "reconstructed": true
    },
    {
      "status": "TRIAGED",
      "at": "2026-09-25T13:51:00.000Z",
      "by": "autonomous-controller",
      "note": "severity and domain assigned",
      "reconstructed": true
    },
    {
      "status": "READY",
      "at": "2026-09-25T13:52:00.000Z",
      "by": "autonomous-controller",
      "note": "root cause traceable in repo; autofix eligible",
      "reconstructed": true
    },
    {
      "status": "INVESTIGATING",
      "at": "2026-09-25T13:53:00.000Z",
      "by": "owner lead",
      "note": "tracing producer → consumer",
      "reconstructed": true
    },
    {
      "status": "ROOT_CAUSE_CONFIRMED",
      "at": "2026-09-25T13:54:00.000Z",
      "by": "owner lead",
      "note": "slashless URLs vs trailingSlash",
      "reconstructed": true
    },
    {
      "status": "FIXING",
      "at": "2026-09-25T13:55:00.000Z",
      "by": "owner lead",
      "note": "served URL form",
      "reconstructed": true
    },
    {
      "status": "VALIDATING",
      "at": "2026-09-25T13:56:00.000Z",
      "by": "qa-lead",
      "note": "tests added; commits 23ded20, 10369be",
      "reconstructed": true
    },
    {
      "status": "REAUDITING",
      "at": "2026-09-25T13:57:00.000Z",
      "by": "auditor",
      "note": "re-running the detecting check on the fixed code",
      "reconstructed": true
    },
    {
      "status": "RESOLVED",
      "at": "2026-09-25T15:22:04.058Z",
      "by": "product-flows-auditor",
      "note": "reaudit: contact posts without 308; sitemap URLs served without redirect"
    },
    {
      "status": "INVESTIGATING",
      "at": "2026-09-26T00:10:57.538Z",
      "by": "autonomous-controller",
      "note": "re-verify: 2c2bdeb requires proofs that together run every requiredTests suite; earlier proofs ran only some"
    },
    {
      "status": "ROOT_CAUSE_CONFIRMED",
      "at": "2026-09-26T00:12:13.034Z",
      "by": "owner",
      "note": "earlier proofs ran only part of requiredTests"
    },
    {
      "status": "FIXING",
      "at": "2026-09-26T00:12:13.124Z",
      "by": "owner",
      "note": "product fix unchanged; re-verification under the all-suites rule (2c2bdeb)"
    },
    {
      "status": "VALIDATING",
      "at": "2026-09-26T00:12:13.223Z",
      "by": "qa-engineer",
      "note": "every requiredTests suite green on HEAD (EV-0051,EV-0058)"
    },
    {
      "status": "REAUDITING",
      "at": "2026-09-26T00:12:13.320Z",
      "by": "regression-reviewer",
      "note": "reaudit: EV-0051,EV-0058"
    },
    {
      "status": "RESOLVED",
      "at": "2026-09-26T00:12:13.446Z",
      "by": "autonomous-controller",
      "note": "proofs EV-0051,EV-0058; server rebuilt from 2c2bdeb"
    }
  ],
  "evidenceRecords": [
    "EV-0017",
    "EV-0024",
    "EV-0051",
    "EV-0058"
  ]
}
