{
  "confidence": "confirmed",
  "dependencies": [],
  "risk": "low",
  "discoveredAt": "2026-09-25T13:50:00.000Z",
  "id": "F-0003",
  "title": "Metrics of an invalidated or replaced Soundcharts identity stay published",
  "severity": "P1",
  "domain": "identity",
  "status": "INVESTIGATING",
  "evidence": [
    "lib/integrations/sync.ts (base): unresolved/not_configured branches clear the UUID but leave artist_metrics/integration_metric_cache",
    "tests/integration/soundcharts-identity-sync.mjs fails on base: 'metrics of an invalidated identity must not stay published'"
  ],
  "rootCause": "Identity lifecycle and metric lifecycle were not coupled: invalidation updated only the identity row; upserts only overwrote platforms returned by the new identity.",
  "producer": [
    "lib/integrations/sync.ts#syncArtistSoundcharts",
    "lib/integrations/sync.ts#syncLanderRecordsSoundcharts"
  ],
  "consumers": [
    "app/(public)/artistas/[slug]/page.tsx",
    "app/(public)/page.tsx social cards",
    "modules/artists/repository.ts"
  ],
  "affectedFlow": "artist links → identity → metrics → public pages",
  "invariantViolated": "Metrics belong to the identity that produced them (ZERO≠NULL≠STALE≠WRONG IDENTITY)",
  "blastRadius": "public follower/listener numbers of the wrong or unverified artist after link edits",
  "autofix": {
    "eligible": true,
    "reason": "root cause proven by DB-backed test; purge is scoped to source='soundcharts' of that entity"
  },
  "correction": "purge entity soundcharts metrics atomically when identity is cleared or its UUID changes; keep values on same-identity outages",
  "requiredTests": [
    "tests/integration/soundcharts-identity-sync.mjs"
  ],
  "regressionRisk": "low — same-identity outage path covered by test",
  "impactLevel": "L3",
  "producerAgent": "identity-auditor",
  "commits": [
    "48b1f3f"
  ],
  "history": [
    {
      "status": "DISCOVERED",
      "at": "2026-09-25T13:50:00.000Z",
      "by": "leads-auditor",
      "note": "identity lifecycle trace",
      "reconstructed": true
    },
    {
      "status": "TRIAGED",
      "at": "2026-09-25T13:51:00.000Z",
      "by": "autonomous-controller",
      "note": "severity and domain assigned",
      "reconstructed": true
    },
    {
      "status": "READY",
      "at": "2026-09-25T13:52:00.000Z",
      "by": "autonomous-controller",
      "note": "root cause traceable in repo; autofix eligible",
      "reconstructed": true
    },
    {
      "status": "INVESTIGATING",
      "at": "2026-09-25T13:53:00.000Z",
      "by": "owner lead",
      "note": "tracing producer → consumer",
      "reconstructed": true
    },
    {
      "status": "ROOT_CAUSE_CONFIRMED",
      "at": "2026-09-25T13:54:00.000Z",
      "by": "owner lead",
      "note": "identity invalidation did not withdraw metrics",
      "reconstructed": true
    },
    {
      "status": "FIXING",
      "at": "2026-09-25T13:55:00.000Z",
      "by": "owner lead",
      "note": "atomic purge on clear/replace",
      "reconstructed": true
    },
    {
      "status": "VALIDATING",
      "at": "2026-09-25T13:56:00.000Z",
      "by": "qa-lead",
      "note": "tests added; commits 48b1f3f",
      "reconstructed": true
    },
    {
      "status": "REAUDITING",
      "at": "2026-09-25T13:57:00.000Z",
      "by": "auditor",
      "note": "re-running the detecting check on the fixed code",
      "reconstructed": true
    },
    {
      "status": "RESOLVED",
      "at": "2026-09-25T15:22:03.535Z",
      "by": "product-flows-auditor",
      "note": "reaudit: DB-backed identity sync (red on base)"
    },
    {
      "status": "INVESTIGATING",
      "at": "2026-09-25T15:27:52.964Z",
      "by": "adversarial-reviewer",
      "note": "reopened: Lander identity path — UUID persisted before fetch; fetch failure leaves old-identity metrics permanently (EV-0029 review)"
    },
    {
      "status": "ROOT_CAUSE_CONFIRMED",
      "at": "2026-09-25T18:51:19.677Z",
      "by": "identity-auditor",
      "note": "new identity persisted before fetch; purge only after successful fetch — reproduced in tests/integration/soundcharts-identity-sync.mjs scenarios 6/7 (red on 9f9dad1)"
    },
    {
      "status": "FIXING",
      "at": "2026-09-25T18:51:19.769Z",
      "by": "backend-lead",
      "note": "persist identity + purge atomically before fetching (both paths); commit 2efe304"
    },
    {
      "status": "VALIDATING",
      "at": "2026-09-25T18:51:19.858Z",
      "by": "qa-lead",
      "note": "DB-backed scenarios green"
    },
    {
      "status": "REAUDITING",
      "at": "2026-09-25T18:52:06.604Z",
      "by": "qa-lead",
      "note": "proof re-run on current code"
    },
    {
      "status": "RESOLVED",
      "at": "2026-09-25T18:52:06.737Z",
      "by": "product-flows-auditor",
      "note": "reaudit: detecting scenario/suite green on current code"
    },
    {
      "status": "INVESTIGATING",
      "at": "2026-09-25T19:02:26.412Z",
      "by": "adversarial-reviewer",
      "note": "reopened: admin save clears UUID without purging Lander cache; sync/admin race (EV-0038)"
    },
    {
      "status": "ROOT_CAUSE_CONFIRMED",
      "at": "2026-09-25T23:28:02.065Z",
      "by": "owner",
      "note": "admin save cleared UUID without purging; in-flight sync could publish a superseded identity"
    },
    {
      "status": "FIXING",
      "at": "2026-09-25T23:28:02.163Z",
      "by": "owner",
      "note": "fix in 9e24ab4 (purge in admin tx, row-locked publish guard)"
    },
    {
      "status": "VALIDATING",
      "at": "2026-09-25T23:28:02.253Z",
      "by": "qa-engineer",
      "note": "required test green on HEAD (EV-0039)"
    },
    {
      "status": "REAUDITING",
      "at": "2026-09-25T23:28:02.340Z",
      "by": "regression-reviewer",
      "note": "reaudit: EV-0039 reproduces reviewer scenario on HEAD"
    },
    {
      "status": "RESOLVED",
      "at": "2026-09-25T23:28:02.460Z",
      "by": "autonomous-controller",
      "note": "proof EV-0039; server rebuilt from HEAD"
    },
    {
      "status": "INVESTIGATING",
      "at": "2026-09-25T23:39:13.142Z",
      "by": "adversarial-reviewer",
      "note": "reopened: unconditional pre-fetch identity write publishes superseded identity; admin purge before row lock; cleared identity not withdrawn (EV-0044)"
    }
  ],
  "evidenceRecords": [
    "EV-0019",
    "EV-0032",
    "EV-0039"
  ]
}
